{
  "$schema": "../game-manifest.schema.json",
  "schemaVersion": 1,
  "id": "three-card-poker",
  "displayName": "Three Card Poker",
  "category": "card",
  "packageVersion": "0.1.0",
  "clientRoute": "/cards/three-card-poker",
  "apiBasePath": "/api/cards/three-card-poker/table",
  "capabilities": [
    "credits",
    "multiplayer",
    "history"
  ],
  "migrationState": "package-backed"
}
